17:21:32.697199 IP (tos 0x0, ttl 64, id 32899, offset 0, flags [DF], proto UDP (17), length 70)
    192.168.25.5.41907 > 192.168.25.1.53: 65134+ A? detectportal.firefox.com. (42)
17:21:32.697320 IP (tos 0x0, ttl 64, id 7476, offset 0, flags [DF], proto UDP (17), length 70)
    192.168.25.5.46624 > 192.168.25.1.53: 37379+ AAAA? detectportal.firefox.com. (42)
17:21:32.737104 IP (tos 0x0, ttl 64, id 0, offset 0, flags [DF], proto UDP (17), length 181)
    192.168.25.1.53 > 192.168.25.5.41907: 65134 3/0/0 detectportal.firefox.com. CNAME detectportal.prod.mozaws.net., detectportal.prod.mozaws.net. CNAME prod.detectportal.prod.cloudops.mozgcp.net., prod.detectportal.prod.cloudops.mozgcp.net. A 34.107.221.82 (153)
17:21:32.757432 IP (tos 0x0, ttl 64, id 0, offset 0, flags [DF], proto UDP (17), length 193)
    192.168.25.1.53 > 192.168.25.5.46624: 37379 3/0/0 detectportal.firefox.com. CNAME detectportal.prod.mozaws.net., detectportal.prod.mozaws.net. CNAME prod.detectportal.prod.cloudops.mozgcp.net., prod.detectportal.prod.cloudops.mozgcp.net. AAAA 2600:1901:0:38d7:: (165)
17:21:32.758119 IP (tos 0x0, ttl 64, id 61600, offset 0, flags [DF], proto TCP (6), length 60)
    192.168.25.5.54148 > 34.107.221.82.80: Flags [S], cksum 0xd999 (incorrect -> 0x1d1c), seq 2452322841, win 64240, options [mss 1460,sackOK,TS val 2515722363 ecr 0,nop,wscale 7], length 0
17:21:32.798487 IP (tos 0x0, ttl 56, id 50902, offset 0, flags [none], proto TCP (6), length 60)
    34.107.221.82.80 > 192.168.25.5.54148: Flags [S.], cksum 0x2871 (correct), seq 3282141212, ack 2452322842, win 65535, options [mss 1430,sackOK,TS val 2013017069 ecr 2515722363,nop,wscale 8], length 0
17:21:32.798528 IP (tos 0x0, ttl 64, id 61601, offset 0, flags [DF], proto TCP (6), length 52)
    192.168.25.5.54148 > 34.107.221.82.80: Flags [.], cksum 0xd991 (incorrect -> 0x5502), ack 1, win 502, options [nop,nop,TS val 2515722403 ecr 2013017069], length 0
17:21:32.798665 IP (tos 0x0, ttl 64, id 61602, offset 0, flags [DF], proto TCP (6), length 374)
    192.168.25.5.54148 > 34.107.221.82.80: Flags [P.], cksum 0xdad3 (incorrect -> 0x965c), seq 1:323, ack 1, win 502, options [nop,nop,TS val 2515722403 ecr 2013017069], length 322: HTTP, length: 322
	GET /canonical.html HTTP/1.1
	Host: detectportal.firefox.com
	User-Agent: Mozilla/5.0 (X11; Ubuntu; Linux x86_64; rv:102.0) Gecko/20100101 Firefox/102.0
	Accept: */*
	Accept-Language: pt-BR,pt;q=0.8,en-US;q=0.5,en;q=0.3
	Accept-Encoding: gzip, deflate
	Cache-Control: no-cache
	Pragma: no-cache
	Connection: keep-alive
	
17:21:32.841842 IP (tos 0x0, ttl 56, id 50940, offset 0, flags [none], proto TCP (6), length 52)
    34.107.221.82.80 > 192.168.25.5.54148: Flags [.], cksum 0x5485 (correct), ack 323, win 261, options [nop,nop,TS val 2013017113 ecr 2515722403], length 0
17:21:32.843432 IP (tos 0x0, ttl 120, id 50941, offset 0, flags [none], proto TCP (6), length 350)
    34.107.221.82.80 > 192.168.25.5.54148: Flags [P.], cksum 0x53b3 (correct), seq 1:299, ack 323, win 261, options [nop,nop,TS val 2013017113 ecr 2515722403], length 298: HTTP, length: 298
	HTTP/1.1 200 OK
	Server: nginx
	Content-Length: 90
	Via: 1.1 google
	Date: Tue, 05 Jul 2022 23:55:26 GMT
	Age: 73566
	Content-Type: text/html
	Cache-Control: public,must-revalidate,max-age=0,s-maxage=3600
	
	<meta http-equiv="refresh" content="0;url=https://support.mozilla.org/kb/captive-portal"/>[!http]
17:21:32.843451 IP (tos 0x0, ttl 64, id 61603, offset 0, flags [DF], proto TCP (6), length 52)
    192.168.25.5.54148 > 34.107.221.82.80: Flags [.], cksum 0xd991 (incorrect -> 0x523e), ack 299, win 501, options [nop,nop,TS val 2515722448 ecr 2013017113], length 0
17:21:32.877771 IP (tos 0x0, ttl 64, id 18842, offset 0, flags [DF], proto UDP (17), length 67)
    192.168.25.5.33922 > 192.168.25.1.53: 37658+ A? start.ubuntu-mate.org. (39)
17:21:32.877871 IP (tos 0x0, ttl 64, id 24574, offset 0, flags [DF], proto UDP (17), length 67)
    192.168.25.5.45339 > 192.168.25.1.53: 53874+ AAAA? start.ubuntu-mate.org. (39)
17:21:32.878784 IP (tos 0x0, ttl 64, id 14135, offset 0, flags [DF], proto UDP (17), length 59)
    192.168.25.5.55181 > 192.168.25.1.53: 54183+ AAAA? ipv4only.arpa. (31)
17:21:32.878796 IP (tos 0x0, ttl 64, id 42737, offset 0, flags [DF], proto TCP (6), length 60)
    192.168.25.5.54150 > 34.107.221.82.80: Flags [S], cksum 0xd999 (incorrect -> 0x73b1), seq 2770931724, win 64240, options [mss 1460,sackOK,TS val 2515722483 ecr 0,nop,wscale 7], length 0
17:21:32.889527 IP (tos 0x0, ttl 64, id 34225, offset 0, flags [DF], proto UDP (17), length 74)
    192.168.25.5.35240 > 192.168.25.1.53: 59061+ A? contile.services.mozilla.com. (46)
17:21:32.889622 IP (tos 0x0, ttl 64, id 62836, offset 0, flags [DF], proto UDP (17), length 74)
    192.168.25.5.49280 > 192.168.25.1.53: 15967+ AAAA? contile.services.mozilla.com. (46)
17:21:32.919057 IP (tos 0x0, ttl 56, id 7120, offset 0, flags [none], proto TCP (6), length 60)
    34.107.221.82.80 > 192.168.25.5.54150: Flags [S.], cksum 0x52b8 (correct), seq 2569108174, ack 2770931725, win 65535, options [mss 1430,sackOK,TS val 3247588979 ecr 2515722483,nop,wscale 8], length 0
17:21:32.919110 IP (tos 0x0, ttl 64, id 42738, offset 0, flags [DF], proto TCP (6), length 52)
    192.168.25.5.54150 > 34.107.221.82.80: Flags [.], cksum 0xd991 (incorrect -> 0x7f48), ack 1, win 502, options [nop,nop,TS val 2515722524 ecr 3247588979], length 0
17:21:32.919275 IP (tos 0x0, ttl 64, id 42739, offset 0, flags [DF], proto TCP (6), length 376)
    192.168.25.5.54150 > 34.107.221.82.80: Flags [P.], cksum 0xdad5 (incorrect -> 0x3969), seq 1:325, ack 1, win 502, options [nop,nop,TS val 2515722524 ecr 3247588979], length 324: HTTP, length: 324
	GET /success.txt?ipv4 HTTP/1.1
	Host: detectportal.firefox.com
	User-Agent: Mozilla/5.0 (X11; Ubuntu; Linux x86_64; rv:102.0) Gecko/20100101 Firefox/102.0
	Accept: */*
	Accept-Language: pt-BR,pt;q=0.8,en-US;q=0.5,en;q=0.3
	Accept-Encoding: gzip, deflate
	Connection: keep-alive
	Pragma: no-cache
	Cache-Control: no-cache
	
17:21:32.956271 IP (tos 0x0, ttl 64, id 0, offset 0, flags [DF], proto UDP (17), length 99)
    192.168.25.1.53 > 192.168.25.5.33922: 37658 2/0/0 start.ubuntu-mate.org. A 104.21.50.239, start.ubuntu-mate.org. A 172.67.213.220 (71)
17:21:32.961972 IP (tos 0x0, ttl 56, id 7147, offset 0, flags [none], proto TCP (6), length 52)
    34.107.221.82.80 > 192.168.25.5.54150: Flags [.], cksum 0x7eca (correct), ack 325, win 261, options [nop,nop,TS val 3247589022 ecr 2515722524], length 0
17:21:32.963132 IP (tos 0x0, ttl 56, id 7148, offset 0, flags [none], proto TCP (6), length 268)
    34.107.221.82.80 > 192.168.25.5.54150: Flags [P.], cksum 0x1f7d (correct), seq 1:217, ack 325, win 261, options [nop,nop,TS val 3247589023 ecr 2515722524], length 216: HTTP, length: 216
	HTTP/1.1 200 OK
	Server: nginx
	Content-Length: 8
	Via: 1.1 google
	Date: Tue, 05 Jul 2022 23:55:14 GMT
	Age: 73578
	Content-Type: text/plain
	Cache-Control: public,must-revalidate,max-age=0,s-maxage=3600
	
	success
17:21:32.963149 IP (tos 0x0, ttl 64, id 42740, offset 0, flags [DF], proto TCP (6), length 52)
    192.168.25.5.54150 > 34.107.221.82.80: Flags [.], cksum 0xd991 (incorrect -> 0x7cd5), ack 217, win 501, options [nop,nop,TS val 2515722568 ecr 3247589023], length 0
17:21:32.978343 IP (tos 0x0, ttl 64, id 0, offset 0, flags [DF], proto UDP (17), length 116)
    192.168.25.1.53 > 192.168.25.5.55181: 54183 0/1/0 (88)
17:21:32.979698 IP (tos 0x0, ttl 64, id 0, offset 0, flags [DF], proto UDP (17), length 123)
    192.168.25.1.53 > 192.168.25.5.45339: 53874 2/0/0 start.ubuntu-mate.org. AAAA 2606:4700:3035::ac43:d5dc, start.ubuntu-mate.org. AAAA 2606:4700:3037::6815:32ef (95)
17:21:32.980460 IP (tos 0x0, ttl 64, id 0, offset 0, flags [DF], proto UDP (17), length 90)
    192.168.25.1.53 > 192.168.25.5.35240: 59061 1/0/0 contile.services.mozilla.com. A 34.117.237.239 (62)
17:21:32.998872 IP (tos 0x0, ttl 64, id 0, offset 0, flags [DF], proto UDP (17), length 155)
    192.168.25.1.53 > 192.168.25.5.49280: 15967 0/1/0 (127)
17:21:33.000590 IP (tos 0x0, ttl 64, id 54179, offset 0, flags [DF], proto TCP (6), length 60)
    192.168.25.5.53948 > 34.117.237.239.443: Flags [S], cksum 0xea40 (incorrect -> 0xe719), seq 2345271815, win 64240, options [mss 1460,sackOK,TS val 616101089 ecr 0,nop,wscale 7], length 0
17:21:33.037078 IP (tos 0x0, ttl 64, id 41198, offset 0, flags [DF], proto UDP (17), length 81)
    192.168.25.5.58349 > 192.168.25.1.53: 44822+ A? content-signature-2.cdn.mozilla.net. (53)
17:21:33.037215 IP (tos 0x0, ttl 64, id 53605, offset 0, flags [DF], proto UDP (17), length 68)
    192.168.25.6.57621 > 192.168.25.255.57621: UDP, length 40
17:21:33.037216 IP (tos 0x0, ttl 64, id 34310, offset 0, flags [DF], proto UDP (17), length 81)
    192.168.25.5.59268 > 192.168.25.1.53: 14299+ AAAA? content-signature-2.cdn.mozilla.net. (53)
17:21:33.045193 IP (tos 0x0, ttl 56, id 44848, offset 0, flags [none], proto TCP (6), length 60)
    34.117.237.239.443 > 192.168.25.5.53948: Flags [S.], cksum 0x1329 (correct), seq 3036782254, ack 2345271816, win 65535, options [mss 1430,sackOK,TS val 124023769 ecr 616101089,nop,wscale 8], length 0
17:21:33.045238 IP (tos 0x0, ttl 64, id 54180, offset 0, flags [DF], proto TCP (6), length 52)
    192.168.25.5.53948 > 34.117.237.239.443: Flags [.], cksum 0xea38 (incorrect -> 0x3fb5), ack 1, win 502, options [nop,nop,TS val 616101134 ecr 124023769], length 0
17:21:33.047519 IP (tos 0x0, ttl 64, id 54181, offset 0, flags [DF], proto TCP (6), length 569)
    192.168.25.5.53948 > 34.117.237.239.443: Flags [P.], cksum 0xec3d (incorrect -> 0x7a79), seq 1:518, ack 1, win 502, options [nop,nop,TS val 616101136 ecr 124023769], length 517
17:21:33.057152 IP (tos 0x0, ttl 64, id 59174, offset 0, flags [DF], proto UDP (17), length 76)
    192.168.25.5.42544 > 192.168.25.1.53: 21735+ A? incoming.telemetry.mozilla.org. (48)
17:21:33.057266 IP (tos 0x0, ttl 64, id 1586, offset 0, flags [DF], proto UDP (17), length 76)
    192.168.25.5.58141 > 192.168.25.1.53: 38900+ AAAA? incoming.telemetry.mozilla.org. (48)
17:21:33.093187 IP (tos 0x0, ttl 120, id 44855, offset 0, flags [none], proto TCP (6), length 1470)
    34.117.237.239.443 > 192.168.25.5.53948: Flags [.], cksum 0xe1f6 (correct), seq 1:1419, ack 518, win 261, options [nop,nop,TS val 124023820 ecr 616101136], length 1418
17:21:33.093233 IP (tos 0x0, ttl 64, id 54182, offset 0, flags [DF], proto TCP (6), length 52)
    192.168.25.5.53948 > 34.117.237.239.443: Flags [.], cksum 0xea38 (incorrect -> 0x37c4), ack 1419, win 501, options [nop,nop,TS val 616101182 ecr 124023820], length 0
17:21:33.094056 IP (tos 0x0, ttl 120, id 44856, offset 0, flags [none], proto TCP (6), length 1470)
    34.117.237.239.443 > 192.168.25.5.53948: Flags [P.], cksum 0x289b (correct), seq 1419:2837, ack 518, win 261, options [nop,nop,TS val 124023820 ecr 616101136], length 1418
17:21:33.094066 IP (tos 0x0, ttl 64, id 54183, offset 0, flags [DF], proto TCP (6), length 52)
    192.168.25.5.53948 > 34.117.237.239.443: Flags [.], cksum 0xea38 (incorrect -> 0x3239), ack 2837, win 501, options [nop,nop,TS val 616101183 ecr 124023820], length 0
17:21:33.095297 IP (tos 0x0, ttl 120, id 44857, offset 0, flags [none], proto TCP (6), length 1470)
    34.117.237.239.443 > 192.168.25.5.53948: Flags [.], cksum 0xeda9 (correct), seq 2837:4255, ack 518, win 261, options [nop,nop,TS val 124023820 ecr 616101136], length 1418
17:21:33.095307 IP (tos 0x0, ttl 64, id 54184, offset 0, flags [DF], proto TCP (6), length 52)
    192.168.25.5.53948 > 34.117.237.239.443: Flags [.], cksum 0xea38 (incorrect -> 0x2cae), ack 4255, win 501, options [nop,nop,TS val 616101184 ecr 124023820], length 0
17:21:33.095590 IP (tos 0x0, ttl 120, id 44858, offset 0, flags [none], proto TCP (6), length 372)
    34.117.237.239.443 > 192.168.25.5.53948: Flags [P.], cksum 0xbc14 (correct), seq 4255:4575, ack 518, win 261, options [nop,nop,TS val 124023820 ecr 616101136], length 320
17:21:33.095596 IP (tos 0x0, ttl 64, id 54185, offset 0, flags [DF], proto TCP (6), length 52)
    192.168.25.5.53948 > 34.117.237.239.443: Flags [.], cksum 0xea38 (incorrect -> 0x2b6e), ack 4575, win 501, options [nop,nop,TS val 616101184 ecr 124023820], length 0
17:21:33.095599 IP (tos 0x0, ttl 56, id 44854, offset 0, flags [none], proto TCP (6), length 52)
    34.117.237.239.443 > 192.168.25.5.53948: Flags [.], cksum 0x3e6d (correct), ack 518, win 261, options [nop,nop,TS val 124023819 ecr 616101136], length 0
17:21:33.095603 IP (tos 0x0, ttl 64, id 54186, offset 0, flags [DF], proto TCP (6), length 52)
    192.168.25.5.53948 > 34.117.237.239.443: Flags [.], cksum 0xea38 (incorrect -> 0x2b6e), ack 4575, win 501, options [nop,nop,TS val 616101184 ecr 124023820], length 0
17:21:33.100743 IP (tos 0x0, ttl 64, id 0, offset 0, flags [DF], proto UDP (17), length 185)
    192.168.25.1.53 > 192.168.25.5.58349: 44822 5/0/0 content-signature-2.cdn.mozilla.net. CNAME d2nxq2uap88usk.cloudfront.net., d2nxq2uap88usk.cloudfront.net. A 52.84.83.117, d2nxq2uap88usk.cloudfront.net. A 52.84.83.104, d2nxq2uap88usk.cloudfront.net. A 52.84.83.25, d2nxq2uap88usk.cloudfront.net. A 52.84.83.47 (157)
17:21:33.120519 IP (tos 0x0, ttl 64, id 0, offset 0, flags [DF], proto UDP (17), length 345)
    192.168.25.1.53 > 192.168.25.5.59268: 14299 9/0/0 content-signature-2.cdn.mozilla.net. CNAME d2nxq2uap88usk.cloudfront.net., d2nxq2uap88usk.cloudfront.net. AAAA 2600:9000:236a:4600:a:da5e:7900:93a1, d2nxq2uap88usk.cloudfront.net. AAAA 2600:9000:236a:200:a:da5e:7900:93a1, d2nxq2uap88usk.cloudfront.net. AAAA 2600:9000:236a:600:a:da5e:7900:93a1, d2nxq2uap88usk.cloudfront.net. AAAA 2600:9000:236a:d400:a:da5e:7900:93a1, d2nxq2uap88usk.cloudfront.net. AAAA 2600:9000:236a:fa00:a:da5e:7900:93a1, d2nxq2uap88usk.cloudfront.net. AAAA 2600:9000:236a:dc00:a:da5e:7900:93a1, d2nxq2uap88usk.cloudfront.net. AAAA 2600:9000:236a:9800:a:da5e:7900:93a1, d2nxq2uap88usk.cloudfront.net. AAAA 2600:9000:236a:6c00:a:da5e:7900:93a1 (317)
17:21:33.121233 IP (tos 0x0, ttl 64, id 25085, offset 0, flags [DF], proto TCP (6), length 60)
    192.168.25.5.57118 > 52.84.83.47.443: Flags [S], cksum 0x615f (incorrect -> 0x8555), seq 1360869599, win 64240, options [mss 1460,sackOK,TS val 3138863259 ecr 0,nop,wscale 7], length 0
17:21:33.123151 IP (tos 0x0, ttl 64, id 0, offset 0, flags [DF], proto UDP (17), length 208)
    192.168.25.1.53 > 192.168.25.5.42544: 21735 3/0/0 incoming.telemetry.mozilla.org. CNAME telemetry-incoming.r53-2.services.mozilla.com., telemetry-incoming.r53-2.services.mozilla.com. CNAME prod.ingestion-edge.prod.dataops.mozgcp.net., prod.ingestion-edge.prod.dataops.mozgcp.net. A 34.120.208.123 (180)
17:21:33.135889 IP (tos 0x0, ttl 64, id 7473, offset 0, flags [DF], proto UDP (17), length 60)
    192.168.25.5.48850 > 192.168.25.1.53: 24232+ A? r3.o.lencr.org. (32)
17:21:33.135979 IP (tos 0x0, ttl 64, id 23561, offset 0, flags [DF], proto UDP (17), length 60)
    192.168.25.5.60751 > 192.168.25.1.53: 31264+ AAAA? r3.o.lencr.org. (32)
17:21:33.156459 IP (tos 0x0, ttl 64, id 0, offset 0, flags [DF], proto UDP (17), length 282)
    192.168.25.1.53 > 192.168.25.5.58141: 38900 2/1/0 incoming.telemetry.mozilla.org. CNAME telemetry-incoming.r53-2.services.mozilla.com., telemetry-incoming.r53-2.services.mozilla.com. CNAME prod.ingestion-edge.prod.dataops.mozgcp.net. (254)
17:21:33.156811 IP (tos 0x0, ttl 64, id 49943, offset 0, flags [DF], proto UDP (17), length 89)
    192.168.25.5.54482 > 192.168.25.1.53: 26636+ AAAA? prod.ingestion-edge.prod.dataops.mozgcp.net. (61)
17:21:33.159897 IP (tos 0x0, ttl 239, id 29310, offset 0, flags [none], proto TCP (6), length 60)
    52.84.83.47.443 > 192.168.25.5.57118: Flags [S.], cksum 0xe785 (correct), seq 1912046815, ack 1360869600, win 65535, options [mss 1440,sackOK,TS val 3826367960 ecr 3138863259,nop,wscale 9], length 0
17:21:33.159942 IP (tos 0x0, ttl 64, id 25086, offset 0, flags [DF], proto TCP (6), length 52)
    192.168.25.5.57118 > 52.84.83.47.443: Flags [.], cksum 0x6157 (incorrect -> 0x1423), ack 1, win 502, options [nop,nop,TS val 3138863298 ecr 3826367960], length 0
17:21:33.160063 IP (tos 0x0, ttl 64, id 25087, offset 0, flags [DF], proto TCP (6), length 268)
    192.168.25.5.57118 > 52.84.83.47.443: Flags [P.], cksum 0x622f (incorrect -> 0xdbe3), seq 1:217, ack 1, win 502, options [nop,nop,TS val 3138863298 ecr 3826367960], length 216
17:21:33.192781 IP (tos 0x0, ttl 64, id 51359, offset 0, flags [DF], proto UDP (17), length 73)
    192.168.25.5.52212 > 192.168.25.1.53: 14642+ A? safebrowsing.googleapis.com. (45)
17:21:33.192875 IP (tos 0x0, ttl 64, id 28573, offset 0, flags [DF], proto UDP (17), length 73)
    192.168.25.5.40389 > 192.168.25.1.53: 36500+ AAAA? safebrowsing.googleapis.com. (45)
17:21:33.197068 IP (tos 0x0, ttl 64, id 0, offset 0, flags [DF], proto UDP (17), length 159)
    192.168.25.1.53 > 192.168.25.5.48850: 24232 4/0/0 r3.o.lencr.org. CNAME o.lencr.edgesuite.net., o.lencr.edgesuite.net. CNAME a1887.dscq.akamai.net., a1887.dscq.akamai.net. A 152.255.32.66, a1887.dscq.akamai.net. A 152.255.32.59 (131)
17:21:33.200947 IP (tos 0x0, ttl 239, id 29312, offset 0, flags [none], proto TCP (6), length 52)
    52.84.83.47.443 > 192.168.25.5.57118: Flags [.], cksum 0x1495 (correct), ack 217, win 131, options [nop,nop,TS val 3826368001 ecr 3138863298], length 0
17:21:33.202392 IP (tos 0x0, ttl 239, id 29313, offset 0, flags [none], proto TCP (6), length 1480)
    52.84.83.47.443 > 192.168.25.5.57118: Flags [.], cksum 0xccc9 (correct), seq 1:1429, ack 217, win 131, options [nop,nop,TS val 3826368002 ecr 3138863298], length 1428
17:21:33.202405 IP (tos 0x0, ttl 64, id 25088, offset 0, flags [DF], proto TCP (6), length 52)
    192.168.25.5.57118 > 52.84.83.47.443: Flags [.], cksum 0x6157 (incorrect -> 0x0d64), ack 1429, win 501, options [nop,nop,TS val 3138863340 ecr 3826368002], length 0
17:21:33.203481 IP (tos 0x0, ttl 239, id 29314, offset 0, flags [none], proto TCP (6), length 1480)
    52.84.83.47.443 > 192.168.25.5.57118: Flags [P.], cksum 0xb0df (correct), seq 1429:2857, ack 217, win 131, options [nop,nop,TS val 3826368002 ecr 3138863298], length 1428
17:21:33.203489 IP (tos 0x0, ttl 64, id 25089, offset 0, flags [DF], proto TCP (6), length 52)
    192.168.25.5.57118 > 52.84.83.47.443: Flags [.], cksum 0x6157 (incorrect -> 0x07cf), ack 2857, win 501, options [nop,nop,TS val 3138863341 ecr 3826368002], length 0
17:21:33.206704 IP (tos 0x0, ttl 239, id 29315, offset 0, flags [none], proto TCP (6), length 1095)
    52.84.83.47.443 > 192.168.25.5.57118: Flags [P.], cksum 0x00b1 (correct), seq 2857:3900, ack 217, win 131, options [nop,nop,TS val 3826368006 ecr 3138863298], length 1043
17:21:33.206734 IP (tos 0x0, ttl 64, id 25090, offset 0, flags [DF], proto TCP (6), length 52)
    192.168.25.5.57118 > 52.84.83.47.443: Flags [.], cksum 0x6157 (incorrect -> 0x03b5), ack 3900, win 501, options [nop,nop,TS val 3138863344 ecr 3826368006], length 0
17:21:33.208816 IP (tos 0x0, ttl 64, id 25091, offset 0, flags [DF], proto TCP (6), length 145)
    192.168.25.5.57118 > 52.84.83.47.443: Flags [P.], cksum 0x61b4 (incorrect -> 0x9e56), seq 217:310, ack 3900, win 501, options [nop,nop,TS val 3138863346 ecr 3826368006], length 93
17:21:33.240937 IP (tos 0x0, ttl 64, id 0, offset 0, flags [DF], proto UDP (17), length 183)
    192.168.25.1.53 > 192.168.25.5.60751: 31264 4/0/0 r3.o.lencr.org. CNAME o.lencr.edgesuite.net., o.lencr.edgesuite.net. CNAME a1887.dscq.akamai.net., a1887.dscq.akamai.net. AAAA 2600:1419:3600:3::17d1:be1d, a1887.dscq.akamai.net. AAAA 2600:1419:3600:3::17d1:be33 (155)
17:21:33.241559 IP (tos 0x0, ttl 64, id 25082, offset 0, flags [DF], proto TCP (6), length 60)
    192.168.25.5.41338 > 152.255.32.59.80: Flags [S], cksum 0x9316 (incorrect -> 0xeb5b), seq 2257719664, win 64240, options [mss 1460,sackOK,TS val 3221869812 ecr 0,nop,wscale 7], length 0
17:21:33.244614 IP (tos 0x0, ttl 64, id 0, offset 0, flags [DF], proto UDP (17), length 182)
    192.168.25.1.53 > 192.168.25.5.54482: 26636 0/1/0 (154)
17:21:33.244941 IP (tos 0x0, ttl 64, id 63744, offset 0, flags [DF], proto TCP (6), length 60)
    192.168.25.5.58064 > 34.120.208.123.443: Flags [S], cksum 0xcccf (incorrect -> 0x53f3), seq 3763313460, win 64240, options [mss 1460,sackOK,TS val 3610113340 ecr 0,nop,wscale 7], length 0
17:21:33.246316 IP (tos 0x0, ttl 64, id 0, offset 0, flags [DF], proto UDP (17), length 89)
    192.168.25.1.53 > 192.168.25.5.52212: 14642 1/0/0 safebrowsing.googleapis.com. A 142.251.128.138 (61)
17:21:33.247250 IP (tos 0x0, ttl 239, id 29319, offset 0, flags [none], proto TCP (6), length 52)
    52.84.83.47.443 > 192.168.25.5.57118: Flags [.], cksum 0x049e (correct), ack 310, win 131, options [nop,nop,TS val 3826368048 ecr 3138863346], length 0
17:21:33.247694 IP (tos 0x0, ttl 239, id 29320, offset 0, flags [none], proto TCP (6), length 223)
    52.84.83.47.443 > 192.168.25.5.57118: Flags [P.], cksum 0x7461 (correct), seq 3900:4071, ack 310, win 131, options [nop,nop,TS val 3826368048 ecr 3138863346], length 171
17:21:33.247705 IP (tos 0x0, ttl 64, id 25092, offset 0, flags [DF], proto TCP (6), length 52)
    192.168.25.5.57118 > 52.84.83.47.443: Flags [.], cksum 0x6157 (incorrect -> 0x025a), ack 4071, win 501, options [nop,nop,TS val 3138863385 ecr 3826368048], length 0
17:21:33.247726 IP (tos 0x0, ttl 239, id 29321, offset 0, flags [none], proto TCP (6), length 121)
    52.84.83.47.443 > 192.168.25.5.57118: Flags [P.], cksum 0xf07d (correct), seq 4071:4140, ack 310, win 131, options [nop,nop,TS val 3826368048 ecr 3138863346], length 69
17:21:33.247735 IP (tos 0x0, ttl 64, id 25093, offset 0, flags [DF], proto TCP (6), length 52)
    192.168.25.5.57118 > 52.84.83.47.443: Flags [.], cksum 0x6157 (incorrect -> 0x0215), ack 4140, win 501, options [nop,nop,TS val 3138863385 ecr 3826368048], length 0
17:21:33.248441 IP (tos 0x0, ttl 64, id 25094, offset 0, flags [DF], proto TCP (6), length 229)
    192.168.25.5.57118 > 52.84.83.47.443: Flags [P.], cksum 0x6208 (incorrect -> 0x3016), seq 310:487, ack 4140, win 501, options [nop,nop,TS val 3138863386 ecr 3826368048], length 177
17:21:33.248608 IP (tos 0x0, ttl 64, id 25095, offset 0, flags [DF], proto TCP (6), length 90)
    192.168.25.5.57118 > 52.84.83.47.443: Flags [P.], cksum 0x617d (incorrect -> 0xadd6), seq 487:525, ack 4140, win 501, options [nop,nop,TS val 3138863386 ecr 3826368048], length 38
17:21:33.260459 IP (tos 0x0, ttl 64, id 0, offset 0, flags [DF], proto UDP (17), length 101)
    192.168.25.1.53 > 192.168.25.5.40389: 36500 1/0/0 safebrowsing.googleapis.com. AAAA 2800:3f0:4001:82c::200a (73)
17:21:33.260960 IP (tos 0x0, ttl 64, id 17614, offset 0, flags [DF], proto TCP (6), length 60)
    192.168.25.5.56204 > 142.251.128.138.443: Flags [S], cksum 0xe961 (incorrect -> 0x1640), seq 1045755153, win 64240, options [mss 1460,sackOK,TS val 466493728 ecr 0,nop,wscale 7], length 0
17:21:33.273867 IP (tos 0x0, ttl 57, id 0, offset 0, flags [DF], proto TCP (6), length 60)
    152.255.32.59.80 > 192.168.25.5.41338: Flags [S.], cksum 0x84f9 (correct), seq 976429746, ack 2257719665, win 28960, options [mss 1452,sackOK,TS val 3396520145 ecr 3221869812,nop,wscale 7], length 0
17:21:33.273909 IP (tos 0x0, ttl 64, id 25083, offset 0, flags [DF], proto TCP (6), length 52)
    192.168.25.5.41338 > 152.255.32.59.80: Flags [.], cksum 0x930e (incorrect -> 0x22c7), ack 1, win 502, options [nop,nop,TS val 3221869845 ecr 3396520145], length 0
17:21:33.274050 IP (tos 0x0, ttl 64, id 25084, offset 0, flags [DF], proto TCP (6), length 496)
    192.168.25.5.41338 > 152.255.32.59.80: Flags [P.], cksum 0x94ca (incorrect -> 0xa76e), seq 1:445, ack 1, win 502, options [nop,nop,TS val 3221869845 ecr 3396520145], length 444: HTTP, length: 444
	POST / HTTP/1.1
	Host: r3.o.lencr.org
	User-Agent: Mozilla/5.0 (X11; Ubuntu; Linux x86_64; rv:102.0) Gecko/20100101 Firefox/102.0
	Accept: */*
	Accept-Language: pt-BR,pt;q=0.8,en-US;q=0.5,en;q=0.3
	Accept-Encoding: gzip, deflate
	Content-Type: application/ocsp-request
	Content-Length: 85
	Connection: keep-alive
	Pragma: no-cache
	Cache-Control: no-cache
	
17:21:33.284046 IP (tos 0x0, ttl 119, id 7432, offset 0, flags [none], proto TCP (6), length 60)
    34.120.208.123.443 > 192.168.25.5.58064: Flags [S.], cksum 0x5bf9 (correct), seq 335637670, ack 3763313461, win 65535, options [mss 1430,sackOK,TS val 567103618 ecr 3610113340,nop,wscale 8], length 0
17:21:33.284085 IP (tos 0x0, ttl 64, id 63745, offset 0, flags [DF], proto TCP (6), length 52)
    192.168.25.5.58064 > 34.120.208.123.443: Flags [.], cksum 0xccc7 (incorrect -> 0x888b), ack 1, win 502, options [nop,nop,TS val 3610113379 ecr 567103618], length 0
17:21:33.284216 IP (tos 0x0, ttl 64, id 63746, offset 0, flags [DF], proto TCP (6), length 263)
    192.168.25.5.58064 > 34.120.208.123.443: Flags [P.], cksum 0xcd9a (incorrect -> 0x8f0b), seq 1:212, ack 1, win 502, options [nop,nop,TS val 3610113379 ecr 567103618], length 211
17:21:33.289108 IP (tos 0x0, ttl 239, id 29322, offset 0, flags [none], proto TCP (6), length 52)
    52.84.83.47.443 > 192.168.25.5.57118: Flags [.], cksum 0x02aa (correct), ack 487, win 133, options [nop,nop,TS val 3826368089 ecr 3138863386], length 0
17:21:33.289126 IP (tos 0x0, ttl 239, id 29323, offset 0, flags [none], proto TCP (6), length 90)
    52.84.83.47.443 > 192.168.25.5.57118: Flags [P.], cksum 0xba55 (correct), seq 4140:4178, ack 487, win 133, options [nop,nop,TS val 3826368089 ecr 3138863386], length 38
17:21:33.289138 IP (tos 0x0, ttl 64, id 25096, offset 0, flags [DF], proto TCP (6), length 52)
    192.168.25.5.57118 > 52.84.83.47.443: Flags [.], cksum 0x6157 (incorrect -> 0x00c5), ack 4178, win 501, options [nop,nop,TS val 3138863427 ecr 3826368089], length 0
17:21:33.289875 IP (tos 0x0, ttl 239, id 29324, offset 0, flags [none], proto TCP (6), length 52)
    52.84.83.47.443 > 192.168.25.5.57118: Flags [.], cksum 0x025d (correct), ack 525, win 133, options [nop,nop,TS val 3826368090 ecr 3138863386], length 0
17:21:33.294873 IP (tos 0x0, ttl 64, id 4878, offset 0, flags [DF], proto UDP (17), length 73)
    192.168.25.5.38242 > 192.168.25.1.53: 59697+ A? services.addons.mozilla.org. (45)
17:21:33.294976 IP (tos 0x0, ttl 64, id 4002, offset 0, flags [DF], proto UDP (17), length 73)
    192.168.25.5.47674 > 192.168.25.1.53: 33375+ AAAA? services.addons.mozilla.org. (45)
17:21:33.300935 IP (tos 0x0, ttl 119, id 21256, offset 0, flags [none], proto TCP (6), length 60)
    142.251.128.138.443 > 192.168.25.5.56204: Flags [S.], cksum 0x113b (correct), seq 3062651996, ack 1045755154, win 65535, options [mss 1430,sackOK,TS val 3986161536 ecr 466493728,nop,wscale 8], length 0
17:21:33.300975 IP (tos 0x0, ttl 64, id 17615, offset 0, flags [DF], proto TCP (6), length 52)
    192.168.25.5.56204 > 142.251.128.138.443: Flags [.], cksum 0xe959 (incorrect -> 0x3dcc), ack 1, win 502, options [nop,nop,TS val 466493768 ecr 3986161536], length 0
17:21:33.302938 IP (tos 0x0, ttl 64, id 17616, offset 0, flags [DF], proto TCP (6), length 569)
    192.168.25.5.56204 > 142.251.128.138.443: Flags [P.], cksum 0xeb5e (incorrect -> 0xf031), seq 1:518, ack 1, win 502, options [nop,nop,TS val 466493770 ecr 3986161536], length 517
17:21:33.309994 IP (tos 0x0, ttl 57, id 19554, offset 0, flags [DF], proto TCP (6), length 52)
    152.255.32.59.80 > 192.168.25.5.41338: Flags [.], cksum 0x21f1 (correct), ack 445, win 235, options [nop,nop,TS val 3396520182 ecr 3221869845], length 0
17:21:33.311283 IP (tos 0x0, ttl 57, id 19555, offset 0, flags [DF], proto TCP (6), length 941)
    152.255.32.59.80 > 192.168.25.5.41338: Flags [P.], cksum 0x7e09 (correct), seq 1:890, ack 445, win 235, options [nop,nop,TS val 3396520183 ecr 3221869845], length 889: HTTP, length: 889
	HTTP/1.1 200 OK
	Server: nginx
	Content-Type: application/ocsp-response
	Content-Length: 503
	ETag: "78A5DCFAF2D93D9C87CFB6DBC56100E9F22965D4500554BA65F71CB7D84DD666"
	Last-Modified: Wed, 06 Jul 2022 16:00:00 UTC
	Cache-Control: public, no-transform, must-revalidate, max-age=20032
	Expires: Thu, 07 Jul 2022 01:55:25 GMT
	Date: Wed, 06 Jul 2022 20:21:33 GMT
	Connection: keep-alive
	
17:21:33.311300 IP (tos 0x0, ttl 64, id 25085, offset 0, flags [DF], proto TCP (6), length 52)
    192.168.25.5.41338 > 152.255.32.59.80: Flags [.], cksum 0x930e (incorrect -> 0x1d48), ack 890, win 501, options [nop,nop,TS val 3221869882 ecr 3396520183], length 0
17:21:33.321045 IP (tos 0x0, ttl 64, id 54187, offset 0, flags [DF], proto TCP (6), length 116)
    192.168.25.5.53948 > 34.117.237.239.443: Flags [P.], cksum 0xea78 (incorrect -> 0x4e87), seq 518:582, ack 4575, win 501, options [nop,nop,TS val 616101410 ecr 124023820], length 64
17:21:33.321411 IP (tos 0x0, ttl 64, id 54188, offset 0, flags [DF], proto TCP (6), length 222)
    192.168.25.5.53948 > 34.117.237.239.443: Flags [P.], cksum 0xeae2 (incorrect -> 0x3db7), seq 582:752, ack 4575, win 501, options [nop,nop,TS val 616101410 ecr 124023820], length 170
17:21:33.321439 IP (tos 0x0, ttl 64, id 54189, offset 0, flags [DF], proto TCP (6), length 309)
    192.168.25.5.53948 > 34.117.237.239.443: Flags [P.], cksum 0xeb39 (incorrect -> 0xf371), seq 752:1009, ack 4575, win 501, options [nop,nop,TS val 616101410 ecr 124023820], length 257
17:21:33.326883 IP (tos 0x0, ttl 119, id 7469, offset 0, flags [none], proto TCP (6), length 52)
    34.120.208.123.443 > 192.168.25.5.58064: Flags [.], cksum 0x887e (correct), ack 212, win 261, options [nop,nop,TS val 567103661 ecr 3610113379], length 0
17:21:33.328546 IP (tos 0x0, ttl 56, id 7470, offset 0, flags [none], proto TCP (6), length 1470)
    34.120.208.123.443 > 192.168.25.5.58064: Flags [.], cksum 0xf6a4 (correct), seq 1:1419, ack 212, win 261, options [nop,nop,TS val 567103662 ecr 3610113379], length 1418
17:21:33.328560 IP (tos 0x0, ttl 64, id 63747, offset 0, flags [DF], proto TCP (6), length 52)
    192.168.25.5.58064 > 34.120.208.123.443: Flags [.], cksum 0xccc7 (incorrect -> 0x81d7), ack 1419, win 501, options [nop,nop,TS val 3610113423 ecr 567103662], length 0
17:21:33.329609 IP (tos 0x0, ttl 56, id 7471, offset 0, flags [none], proto TCP (6), length 1470)
    34.120.208.123.443 > 192.168.25.5.58064: Flags [P.], cksum 0x9b87 (correct), seq 1419:2837, ack 212, win 261, options [nop,nop,TS val 567103662 ecr 3610113379], length 1418
17:21:33.329619 IP (tos 0x0, ttl 64, id 63748, offset 0, flags [DF], proto TCP (6), length 52)
    192.168.25.5.58064 > 34.120.208.123.443: Flags [.], cksum 0xccc7 (incorrect -> 0x7c4c), ack 2837, win 501, options [nop,nop,TS val 3610113424 ecr 567103662], length 0
17:21:33.329982 IP (tos 0x0, ttl 56, id 7472, offset 0, flags [none], proto TCP (6), length 567)
    34.120.208.123.443 > 192.168.25.5.58064: Flags [P.], cksum 0x92b0 (correct), seq 2837:3352, ack 212, win 261, options [nop,nop,TS val 567103662 ecr 3610113379], length 515
17:21:33.329988 IP (tos 0x0, ttl 64, id 63749, offset 0, flags [DF], proto TCP (6), length 52)
    192.168.25.5.58064 > 34.120.208.123.443: Flags [.], cksum 0xccc7 (incorrect -> 0x7a48), ack 3352, win 501, options [nop,nop,TS val 3610113425 ecr 567103662], length 0
17:21:33.331294 IP (tos 0x0, ttl 64, id 63750, offset 0, flags [DF], proto TCP (6), length 145)
    192.168.25.5.58064 > 34.120.208.123.443: Flags [P.], cksum 0xcd24 (incorrect -> 0xc87c), seq 212:305, ack 3352, win 501, options [nop,nop,TS val 3610113426 ecr 567103662], length 93
17:21:33.334962 IP (tos 0x0, ttl 64, id 24689, offset 0, flags [DF], proto UDP (17), length 64)
    192.168.25.5.55745 > 192.168.25.1.53: 56464+ AAAA? cs9.wac.phicdn.net. (36)
17:21:33.339257 IP (tos 0x0, ttl 64, id 0, offset 0, flags [DF], proto UDP (17), length 137)
    192.168.25.1.53 > 192.168.25.5.38242: 59697 4/0/0 services.addons.mozilla.org. A 65.8.248.61, services.addons.mozilla.org. A 65.8.248.50, services.addons.mozilla.org. A 65.8.248.12, services.addons.mozilla.org. A 65.8.248.20 (109)
17:21:33.347149 IP (tos 0x0, ttl 119, id 21257, offset 0, flags [none], proto TCP (6), length 52)
    142.251.128.138.443 > 192.168.25.5.56204: Flags [.], cksum 0x3c88 (correct), ack 518, win 261, options [nop,nop,TS val 3986161582 ecr 466493770], length 0
17:21:33.360317 IP (tos 0x0, ttl 64, id 0, offset 0, flags [DF], proto UDP (17), length 154)
    192.168.25.1.53 > 192.168.25.5.47674: 33375 0/1/0 (126)
17:21:33.360722 IP (tos 0x0, ttl 64, id 50020, offset 0, flags [DF], proto TCP (6), length 60)
    192.168.25.5.45798 > 65.8.248.61.443: Flags [S], cksum 0x1322 (incorrect -> 0xb3b7), seq 924951581, win 64240, options [mss 1460,sackOK,TS val 634572977 ecr 0,nop,wscale 7], length 0
17:21:33.360765 IP (tos 0x0, ttl 64, id 57278, offset 0, flags [DF], proto TCP (6), length 60)
    192.168.25.5.45800 > 65.8.248.61.443: Flags [S], cksum 0x1322 (incorrect -> 0xc267), seq 1549299764, win 64240, options [mss 1460,sackOK,TS val 634572977 ecr 0,nop,wscale 7], length 0
17:21:33.362933 IP (tos 0x0, ttl 119, id 45069, offset 0, flags [none], proto TCP (6), length 632)
    34.117.237.239.443 > 192.168.25.5.53948: Flags [P.], cksum 0x3ac1 (correct), seq 4575:5155, ack 582, win 261, options [nop,nop,TS val 124024091 ecr 616101410], length 580
17:21:33.362951 IP (tos 0x0, ttl 64, id 54190, offset 0, flags [DF], proto TCP (6), length 52)
    192.168.25.5.53948 > 34.117.237.239.443: Flags [.], cksum 0xea38 (incorrect -> 0x2524), ack 5155, win 501, options [nop,nop,TS val 616101452 ecr 124024091], length 0
17:21:33.363320 IP (tos 0x0, ttl 64, id 54191, offset 0, flags [DF], proto TCP (6), length 83)
    192.168.25.5.53948 > 34.117.237.239.443: Flags [P.], cksum 0xea57 (incorrect -> 0xb1e0), seq 1009:1040, ack 5155, win 501, options [nop,nop,TS val 616101452 ecr 124024091], length 31
17:21:33.363605 IP (tos 0x0, ttl 119, id 45070, offset 0, flags [none], proto TCP (6), length 83)
    34.117.237.239.443 > 192.168.25.5.53948: Flags [P.], cksum 0x2bbf (correct), seq 5155:5186, ack 752, win 265, options [nop,nop,TS val 124024092 ecr 616101410], length 31
17:21:33.363618 IP (tos 0x0, ttl 64, id 54192, offset 0, flags [DF], proto TCP (6), length 52)
    192.168.25.5.53948 > 34.117.237.239.443: Flags [.], cksum 0xea38 (incorrect -> 0x24e5), ack 5186, win 501, options [nop,nop,TS val 616101452 ecr 124024092], length 0
17:21:33.371093 IP (tos 0x0, ttl 56, id 45074, offset 0, flags [none], proto TCP (6), length 52)
    34.117.237.239.443 > 192.168.25.5.53948: Flags [.], cksum 0x260e (correct), ack 1009, win 269, options [nop,nop,TS val 124024100 ecr 616101410], length 0
17:21:33.377094 IP (tos 0x0, ttl 56, id 7495, offset 0, flags [none], proto TCP (6), length 344)
    34.120.208.123.443 > 192.168.25.5.58064: Flags [P.], cksum 0xfd2a (correct), seq 3352:3644, ack 305, win 261, options [nop,nop,TS val 567103706 ecr 3610113426], length 292
17:21:33.377120 IP (tos 0x0, ttl 64, id 63751, offset 0, flags [DF], proto TCP (6), length 52)
    192.168.25.5.58064 > 34.120.208.123.443: Flags [.], cksum 0xccc7 (incorrect -> 0x786c), ack 3644, win 501, options [nop,nop,TS val 3610113472 ecr 567103706], length 0
17:21:33.377126 IP (tos 0x0, ttl 56, id 7496, offset 0, flags [none], proto TCP (6), length 121)
    34.120.208.123.443 > 192.168.25.5.58064: Flags [P.], cksum 0xb15a (correct), seq 3644:3713, ack 305, win 261, options [nop,nop,TS val 567103706 ecr 3610113426], length 69
17:21:33.377131 IP (tos 0x0, ttl 64, id 63752, offset 0, flags [DF], proto TCP (6), length 52)
    192.168.25.5.58064 > 34.120.208.123.443: Flags [.], cksum 0xccc7 (incorrect -> 0x7827), ack 3713, win 501, options [nop,nop,TS val 3610113472 ecr 567103706], length 0
17:21:33.378632 IP (tos 0x0, ttl 64, id 0, offset 0, flags [DF], proto UDP (17), length 132)
    192.168.25.1.53 > 192.168.25.5.55745: 56464 0/1/0 (104)
17:21:33.378968 IP (tos 0x0, ttl 64, id 17712, offset 0, flags [DF], proto TCP (6), length 60)
    192.168.25.5.37942 > 192.16.58.8.80: Flags [S], cksum 0xd3f4 (incorrect -> 0x86ff), seq 2117607539, win 64240, options [mss 1460,sackOK,TS val 3152741164 ecr 0,nop,wscale 7], length 0
17:21:33.401107 IP (tos 0x0, ttl 56, id 21269, offset 0, flags [none], proto TCP (6), length 1470)
    142.251.128.138.443 > 192.168.25.5.56204: Flags [.], cksum 0xe40c (correct), seq 1:1419, ack 518, win 261, options [nop,nop,TS val 3986161635 ecr 466493770], length 1418
17:21:33.401130 IP (tos 0x0, ttl 64, id 17617, offset 0, flags [DF], proto TCP (6), length 52)
    192.168.25.5.56204 > 142.251.128.138.443: Flags [.], cksum 0xe959 (incorrect -> 0x3577), ack 1419, win 501, options [nop,nop,TS val 466493868 ecr 3986161635], length 0
17:21:33.402012 IP (tos 0x0, ttl 56, id 21270, offset 0, flags [none], proto TCP (6), length 1470)
    142.251.128.138.443 > 192.168.25.5.56204: Flags [P.], cksum 0xc87d (correct), seq 1419:2837, ack 518, win 261, options [nop,nop,TS val 3986161635 ecr 466493770], length 1418
17:21:33.402017 IP (tos 0x0, ttl 64, id 17618, offset 0, flags [DF], proto TCP (6), length 52)
    192.168.25.5.56204 > 142.251.128.138.443: Flags [.], cksum 0xe959 (incorrect -> 0x2fec), ack 2837, win 501, options [nop,nop,TS val 466493869 ecr 3986161635], length 0
17:21:33.403064 IP (tos 0x0, ttl 56, id 21271, offset 0, flags [none], proto TCP (6), length 1470)
    142.251.128.138.443 > 192.168.25.5.56204: Flags [.], cksum 0xe069 (correct), seq 2837:4255, ack 518, win 261, options [nop,nop,TS val 3986161635 ecr 466493770], length 1418
17:21:33.403069 IP (tos 0x0, ttl 64, id 17619, offset 0, flags [DF], proto TCP (6), length 52)
    192.168.25.5.56204 > 142.251.128.138.443: Flags [.], cksum 0xe959 (incorrect -> 0x2a61), ack 4255, win 501, options [nop,nop,TS val 466493870 ecr 3986161635], length 0
17:21:33.403361 IP (tos 0x0, ttl 56, id 21272, offset 0, flags [none], proto TCP (6), length 482)
    142.251.128.138.443 > 192.168.25.5.56204: Flags [P.], cksum 0xe9a4 (correct), seq 4255:4685, ack 518, win 261, options [nop,nop,TS val 3986161635 ecr 466493770], length 430
17:21:33.403370 IP (tos 0x0, ttl 64, id 17620, offset 0, flags [DF], proto TCP (6), length 52)
    192.168.25.5.56204 > 142.251.128.138.443: Flags [.], cksum 0xe959 (incorrect -> 0x28b3), ack 4685, win 501, options [nop,nop,TS val 466493870 ecr 3986161635], length 0
17:21:33.403372 IP (tos 0x0, ttl 56, id 45104, offset 0, flags [none], proto TCP (6), length 52)
    34.117.237.239.443 > 192.168.25.5.53948: Flags [.], cksum 0x25a5 (correct), ack 1040, win 269, options [nop,nop,TS val 124024132 ecr 616101452], length 0
17:21:33.409599 IP (tos 0x0, ttl 64, id 352, offset 0, flags [DF], proto UDP (17), length 59)
    192.168.25.5.55744 > 192.168.25.1.53: 46685+ A? ocsp.pki.goog. (31)
17:21:33.409723 IP (tos 0x0, ttl 64, id 19024, offset 0, flags [DF], proto UDP (17), length 59)
    192.168.25.5.59732 > 192.168.25.1.53: 60688+ AAAA? ocsp.pki.goog. (31)
17:21:33.417012 IP (tos 0x0, ttl 53, id 52294, offset 0, flags [none], proto TCP (6), length 60)
    192.16.58.8.80 > 192.168.25.5.37942: Flags [S.], cksum 0x4923 (correct), seq 4255628216, ack 2117607540, win 65535, options [mss 1452,sackOK,TS val 3417879464 ecr 3152741164,nop,wscale 9], length 0
17:21:33.417084 IP (tos 0x0, ttl 64, id 17713, offset 0, flags [DF], proto TCP (6), length 52)
    192.168.25.5.37942 > 192.16.58.8.80: Flags [.], cksum 0xd3ec (incorrect -> 0x75cd), ack 1, win 502, options [nop,nop,TS val 3152741202 ecr 3417879464], length 0
17:21:33.417319 IP (tos 0x0, ttl 64, id 17714, offset 0, flags [DF], proto TCP (6), length 497)
    192.168.25.5.37942 > 192.16.58.8.80: Flags [P.], cksum 0xd5a9 (incorrect -> 0x378b), seq 1:446, ack 1, win 502, options [nop,nop,TS val 3152741202 ecr 3417879464], length 445: HTTP, length: 445
	POST / HTTP/1.1
	Host: ocsp.digicert.com
	User-Agent: Mozilla/5.0 (X11; Ubuntu; Linux x86_64; rv:102.0) Gecko/20100101 Firefox/102.0
	Accept: */*
	Accept-Language: pt-BR,pt;q=0.8,en-US;q=0.5,en;q=0.3
	Accept-Encoding: gzip, deflate
	Content-Type: application/ocsp-request
	Content-Length: 83
	Connection: keep-alive
	Pragma: no-cache
	Cache-Control: no-cache
	
